{
  "ts": "20260522_143012",
  "task_id": "task_001",
  "task": "로그인 속도 개선",
  "status": "completed",
  "impact": {
    "user_visible": "로그인 시간이 1.2초에서 0.3초로 빨라집니다",
    "irreversible": "기존 로그인 세션이 만료됩니다 (사용자가 한 번 재로그인 필요)",
    "side_effects": [
      "첫 실행 시 캐시가 초기화됩니다",
      "인터넷 익스플로러에서는 동작하지 않습니다"
    ]
  },
  "tech_detail": {
    "files_changed": [
      "src/auth/login.service.ts",
      "src/auth/token.cache.ts"
    ],
    "tests": {
      "passed": 12,
      "failed": 0,
      "skipped": 1
    },
    "errors": [],
    "next_required": null
  }
}
